{
 "schema": 1,
 "slug": "bulgarian-adaptation",
 "version": 1,
 "title": {
  "ru": "Болгарская система: адаптация",
  "en": "Bulgarian system: adaptation"
 },
 "summary": {
  "ru": "12 недель. Начинаем с трёх коротких дней в неделю, затем добавляем день за этапом: 3, 4, 5. Синглы от 50% до опорного веса, «максимум дня» в тяжёлые недели, присед в каждой неделе. Вес стоит, растёт число синглов, потом +5 пунктов.",
  "en": "12 weeks. Start with three short days a week, then add a day per stage: 3, 4, 5. Singles from 50% to a working percent, a day max in heavy weeks, squats every week. The load stays, singles grow, then +5 points."
 },
 "params": {
  "weeks": 12,
  "session_minutes": [
   30,
   60
  ],
  "days_per_week": [
   3,
   5
  ],
  "week_types": {
   "volume": 1,
   "medium": 6,
   "high": 2,
   "deload": 3
  }
 },
 "required_lifts": [
  "squat_snatch",
  "clean_and_jerk",
  "back_squat"
 ],
 "optional_lifts": [
  "front_squat"
 ],
 "rules": {
  "on_miss": "drop_5kg_continue",
  "deload_pct": 70,
  "illness_drop_pct": 10,
  "test_freshness_days": 60
 },
 "weeks": [
  {
   "week": 1,
   "type": "volume",
   "title": {
    "ru": "Неделя 1: объёмная",
    "en": "Week 1: volume"
   },
   "note": {
    "ru": "Старт: три коротких дня. Синглы до 70%, без отказа и без «героизма». Техника важнее веса.",
    "en": "Start: three short days. Singles up to 70%, no grinding. Technique before load."
   },
   "sessions": [
    {
     "idx": 1,
     "dow": 0,
     "kind": "normal",
     "minutes": 30,
     "title": {
      "ru": "Рывок + присед",
      "en": "Snatch + squat"
     },
     "blocks": [
      {
       "title": {
        "ru": "Основная часть",
        "en": "Main work"
       },
       "exercises": [
        {
         "id": "snatch",
         "lift": "squat_snatch",
         "name": {
          "ru": "Рывок в сед",
          "en": "Squat snatch"
         },
         "steps": [
          {
           "ladder": [
            50,
            60,
            70,
            70,
            70,
            70
           ],
           "reps": 1,
           "rest_sec": [
            60,
            60,
            90,
            90,
            90,
            90
           ]
          }
         ]
        },
        {
         "id": "squat",
         "lift": "back_squat",
         "name": {
          "ru": "Присед на спине",
          "en": "Back squat"
         },
         "steps": [
          {
           "pct": 70,
           "sets": 3,
           "reps": 5,
           "rest_sec": 150
          }
         ]
        }
       ]
      }
     ],
     "purpose": {
      "ru": "Рывок и присед. Рывок учит скорости и точности под штангой, присед строит силу ног для вставания из седа. Это основа недели.",
      "en": "Snatch and squat. The snatch trains speed and accuracy under the bar, the squat builds leg strength for standing out of the catch. The base of the week."
     },
     "focus": {
      "ru": [
       "рывок",
       "присед"
      ],
      "en": [
       "snatch",
       "squat"
      ]
     },
     "intensity": "base"
    },
    {
     "idx": 2,
     "dow": 2,
     "kind": "normal",
     "minutes": 30,
     "title": {
      "ru": "Взятие и толчок + фронтальный",
      "en": "C&J + front squat"
     },
     "blocks": [
      {
       "title": {
        "ru": "Основная часть",
        "en": "Main work"
       },
       "exercises": [
        {
         "id": "cj",
         "lift": "clean_and_jerk",
         "name": {
          "ru": "Взятие и толчок",
          "en": "Clean & jerk"
         },
         "steps": [
          {
           "ladder": [
            50,
            60,
            70,
            70,
            70,
            70
           ],
           "reps": 1,
           "rest_sec": [
            60,
            60,
            90,
            90,
            90,
            90
           ]
          }
         ]
        },
        {
         "id": "front",
         "lift": "front_squat",
         "name": {
          "ru": "Фронтальный присед",
          "en": "Front squat"
         },
         "steps": [
          {
           "pct": 65,
           "sets": 3,
           "reps": 3,
           "rest_sec": 120
          }
         ]
        }
       ]
      }
     ],
     "purpose": {
      "ru": "Взятие и толчок плюс фронтальный присед. Фронтальный укрепляет стойку на груди и ноги, которые нужны, чтобы встать из взятия. Само взятие и толчок отрабатывается в той же логике лесенки и синглов.",
      "en": "Clean & jerk plus front squat. The front squat strengthens the rack position and the legs you need to stand out of the clean. The C&J itself follows the same ladder-and-singles logic."
     },
     "focus": {
      "ru": [
       "взятие и толчок",
       "фронтальный присед"
      ],
      "en": [
       "clean & jerk",
       "front squat"
      ]
     },
     "intensity": "base"
    },
    {
     "idx": 3,
     "dow": 4,
     "kind": "normal",
     "minutes": 30,
     "title": {
      "ru": "Лёгкий день: техника + присед",
      "en": "Light day: technique + squat"
     },
     "blocks": [
      {
       "title": {
        "ru": "Основная часть",
        "en": "Main work"
       },
       "exercises": [
        {
         "id": "snatch",
         "lift": "squat_snatch",
         "name": {
          "ru": "Рывок в сед",
          "en": "Squat snatch"
         },
         "steps": [
          {
           "ladder": [
            50,
            60,
            70
           ],
           "reps": 1,
           "rest_sec": [
            60,
            60,
            90
           ]
          }
         ]
        },
        {
         "id": "cj",
         "lift": "clean_and_jerk",
         "name": {
          "ru": "Взятие и толчок",
          "en": "Clean & jerk"
         },
         "steps": [
          {
           "ladder": [
            50,
            60,
            70
           ],
           "reps": 1,
           "rest_sec": [
            60,
            60,
            90
           ]
          }
         ]
        },
        {
         "id": "squat",
         "lift": "back_squat",
         "name": {
          "ru": "Присед на спине",
          "en": "Back squat"
         },
         "steps": [
          {
           "pct": 65,
           "sets": 2,
           "reps": 5,
           "rest_sec": 150
          }
         ]
        }
       ]
      }
     ],
     "purpose": {
      "ru": "Лёгкий день: техника и восстановление. Лёгкие веса, чистые движения, без усталости. Нужен, чтобы сохранять частоту тренировок и не накапливать утомление.",
      "en": "A light day: technique and recovery. Light weights, clean reps, no fatigue. It keeps the training frequency up without piling on tiredness."
     },
     "focus": {
      "ru": [
       "техника",
       "присед"
      ],
      "en": [
       "technique",
       "squat"
      ]
     },
     "intensity": "light"
    }
   ]
  },
  {
   "week": 2,
   "type": "medium",
   "title": {
    "ru": "Неделя 2: средняя",
    "en": "Week 2: medium"
   },
   "note": {
    "ru": "",
    "en": ""
   },
   "sessions": [
    {
     "idx": 1,
     "dow": 0,
     "kind": "normal",
     "minutes": 30,
     "title": {
      "ru": "Рывок + присед",
      "en": "Snatch + squat"
     },
     "blocks": [
      {
       "title": {
        "ru": "Основная часть",
        "en": "Main work"
       },
       "exercises": [
        {
         "id": "snatch",
         "lift": "squat_snatch",
         "name": {
          "ru": "Рывок в сед",
          "en": "Squat snatch"
         },
         "steps": [
          {
           "ladder": [
            50,
            60,
            70,
            75,
            75
           ],
           "reps": 1,
           "rest_sec": [
            60,
            60,
            90,
            90,
            90
           ]
          }
         ]
        },
        {
         "id": "squat",
         "lift": "back_squat",
         "name": {
          "ru": "Присед на спине",
          "en": "Back squat"
         },
         "steps": [
          {
           "pct": 72.5,
           "sets": 3,
           "reps": 5,
           "rest_sec": 150
          }
         ]
        }
       ]
      }
     ],
     "purpose": {
      "ru": "Рывок и присед. Рывок учит скорости и точности под штангой, присед строит силу ног для вставания из седа. Это основа недели.",
      "en": "Snatch and squat. The snatch trains speed and accuracy under the bar, the squat builds leg strength for standing out of the catch. The base of the week."
     },
     "focus": {
      "ru": [
       "рывок",
       "присед"
      ],
      "en": [
       "snatch",
       "squat"
      ]
     },
     "intensity": "base"
    },
    {
     "idx": 2,
     "dow": 2,
     "kind": "normal",
     "minutes": 30,
     "title": {
      "ru": "Взятие и толчок + фронтальный",
      "en": "C&J + front squat"
     },
     "blocks": [
      {
       "title": {
        "ru": "Основная часть",
        "en": "Main work"
       },
       "exercises": [
        {
         "id": "cj",
         "lift": "clean_and_jerk",
         "name": {
          "ru": "Взятие и толчок",
          "en": "Clean & jerk"
         },
         "steps": [
          {
           "ladder": [
            50,
            60,
            70,
            75,
            75
           ],
           "reps": 1,
           "rest_sec": [
            60,
            60,
            90,
            90,
            90
           ]
          }
         ]
        },
        {
         "id": "front",
         "lift": "front_squat",
         "name": {
          "ru": "Фронтальный присед",
          "en": "Front squat"
         },
         "steps": [
          {
           "pct": 67.5,
           "sets": 3,
           "reps": 3,
           "rest_sec": 120
          }
         ]
        }
       ]
      }
     ],
     "purpose": {